省级地区,第一申请人,首次年份,活跃年份数
浙江省,浙江中控信息产业股份有限公司,2025,1
浙江省,浙江之江数安量子科技有限公司,2025,1
浙江省,浙江九州量子信息技术股份有限公司,2021,5
浙江省,浙江兴森科技有限公司,2025,1
浙江省,浙江国测量子技术研究有限公司,2025,1
浙江省,浙江国盾量子电力科技有限公司,2022,3
浙江省,浙江大升电子开发有限公司,2023,1
浙江省,浙江新华移动传媒股份有限公司,2025,1
浙江省,浙江新迪嘉禾食品有限公司,2024,1
浙江省,浙江法拉第激光科技有限公司,2021,4
浙江省,浙江神州量子网络科技有限公司,2021,3
浙江省,浙江赛思电子科技有限公司,2022,2
浙江省,浙江辰域量子科技有限公司,2025,1
浙江省,湖州中芯半导体科技有限公司,2023,1
浙江省,绍兴清研微科技有限公司,2024,1
浙江省,聚光科技(杭州)股份有限公司,2022,1
浙江省,聚芯光子科技(台州)有限责任公司,2025,1
浙江省,金华新天齿轮有限公司,2024,1
浙江省,闪捷信息科技有限公司,2023,1
浙江省,阿里云计算有限公司,2022,2
浙江省,阿里巴巴(中国)有限公司,2025,1
浙江省,阿里巴巴达摩院(杭州)科技有限公司,2022,4
海南省,海南即客科技有限公司,2024,1
湖北省,三峡智能工程有限公司,2024,1
湖北省,东风汽车集团有限公司,2021,1
湖北省,东风汽车集团股份有限公司,2025,1
湖北省,中冶武勘工程技术有限公司,2025,1
湖北省,中国电力科学研究院有限公司武汉分院,2025,1
湖北省,中国航天三江集团有限公司,2024,1
湖北省,中国船舶重工集团公司第七一七研究所,2021,1
湖北省,中国船舶集团有限公司第七一九研究所,2024,1
湖北省,中国长江三峡集团有限公司,2025,1
湖北省,中电科长江数据有限公司,2025,1
湖北省,中科酷原科技(武汉)有限公司,2024,2
湖北省,中科酷原量子科技(武汉)有限公司,2024,1
湖北省,华中光电技术研究所(中国船舶重工集团公司第七一七研究所),2021,4
湖北省,华中光电技术研究所(中国船舶重工集团有限公司第七一七研究所),2023,1
湖北省,华中光电技术研究所(中国船舶集团有限公司第七一七研究所),2023,3
湖北省,国网湖北省电力有限公司,2024,1
湖北省,国网湖北省电力有限公司电力科学研究院,2021,1
湖北省,国网湖北省电力有限公司经济技术研究院,2025,1
湖北省,武汉中科锐择光电科技有限公司,2023,2
湖北省,武汉亦芯微电子有限公司,2024,1
湖北省,武汉光谷信息光电子创新中心有限公司,2024,2
湖北省,武汉华中天纬测控有限公司,2024,1
湖北省,武汉和悦数字科技有限公司,2022,1
湖北省,武汉市莱布尼兹科技有限责任公司,2024,1
湖北省,武汉昊衡科技有限公司,2021,1
湖北省,武汉瑞斯通信科技有限公司,2025,1
湖北省,武汉耐维斯顿科技有限公司,2023,1
湖北省,武汉聚智惠仁信息技术有限公司,2025,1
湖北省,武汉船舶通信研究所(中国船舶重工集团公司第七二二研究所),2022,2
湖北省,武汉船舶通信研究所(中国船舶集团有限公司第七二二研究所),2025,1
湖北省,武汉邮电科学研究院有限公司,2022,1
湖北省,武汉非秒迅连科技有限公司,2025,1
湖北省,海思光电子有限公司,2022,1
湖北省,湖北华中电力科技开发有限责任公司,2025,1
湖北省,湖北良顷农业科技有限公司,2025,1
湖北省,航天科工空间工程发展有限公司,2025,1
湖北省,长江存储科技有限责任公司,2021,1
湖北省,长江量子(武汉)科技有限公司,2022,4
湖南省,中国建筑第五工程局有限公司,2025,1
湖南省,中科智感科技(湖南)有限公司,2025,1
湖南省,国网湖南省电力有限公司,2025,1
湖南省,国网湖南省电力有限公司电力科学研究院,2025,1
湖南省,恒辉信达技术有限公司,2025,1
湖南省,星汉时空科技(长沙)有限公司,2022,1
湖南省,湖南万脉医疗科技有限公司,2025,1
湖南省,湖南三湘银行股份有限公司,2023,2
湖南省,湖南中电星河电子有限公司,2025,1
湖南省,湖南冠力智能装备有限公司,2025,1
湖南省,湖南创信伟立科技股份有限公司,2025,1
湖南省,湖南博润微电半导体科技有限公司,2024,1
湖南省,湖南哥禄安科技有限公司,2024,1
湖南省,湖南尚医康医疗科技有限公司,2023,1
湖南省,湖南时空信安科技有限公司,2023,2
湖南省,湖南泊序智能测控研究院有限公司,2023,1
湖南省,湖南省时空基准科技有限公司,2021,1
湖南省,湖南省通晓信息科技有限公司,2025,1
湖南省,湖南矩阵电子科技有限公司,2024,1
湖南省,湖南科舰能源发展有限公司,2025,1
湖南省,湖南豪瓦特防务科技有限公司,2023,1
湖南省,湖南遥昇通信技术有限公司,2024,1
湖南省,航天科工(长沙)新材料研究院有限公司,2024,1
湖南省,长沙量子研发中心有限公司,2025,1
湖南省,长沙金域医学检验实验室有限公司,2024,1
甘肃省,万桥信息技术有限公司,2024,1
甘肃省,兰州百源基因技术有限公司,2024,1
甘肃省,国网甘肃省电力公司信息通信公司,2022,1
福建省,厦门拾聚科技有限公司,2025,1
福建省,厦门潭宏信息科技有限公司,2024,1
福建省,厦门美亚亿安信息科技有限公司,2025,1
福建省,国网信通亿力科技有限责任公司,2023,1
福建省,国网福建省电力有限公司,2021,4
福建省,国网福建省电力有限公司信息通信分公司,2023,1
福建省,国网福建省电力有限公司莆田供电公司,2025,1
福建省,国网福建省电力有限公司营销服务中心,2025,1
福建省,数字兵符(福州)科技有限公司,2023,2
福建省,智慧谷(厦门)物联科技有限公司,2023,1
福建省,泉州市创新电子科技有限公司,2024,1
福建省,泉州市金同信息科技有限公司,2025,1
福建省,福州创腾信息技术有限公司,2025,1
福建省,福州昇宇门控智能科技有限公司,2025,1
福建省,福州智元仪器设备有限公司,2025,1
福建省,福建佰越科技有限公司,2025,1
福建省,福建北峰通信科技股份有限公司,2021,1
福建省,福建嘉恒信息科技有限公司,2024,1
福建省,福建省泰昌信息技术有限公司,2025,1
福建省,福建睿斯科医疗技术有限公司,2025,1
福建省,科华恒盛股份有限公司,2021,1
福建省,科华数据股份有限公司,2021,1
福建省,莆田市烛火信息技术有限公司,2021,1
贵州省,贵州电网有限责任公司,2023,2
贵州省,贵州电网有限责任公司信息中心,2024,1
贵州省,贵阳中车浦镇城市轨道交通装备服务有限公司,2025,1
辽宁省,东软睿驰汽车技术(沈阳)有限公司,2024,1
辽宁省,任重科技发展(大连)有限公司,2024,1
辽宁省,国网东北分部绿源水力发电公司太平湾发电厂,2024,1
辽宁省,国网辽宁省电力有限公司,2023,1
辽宁省,国网辽宁省电力有限公司丹东供电公司,2024,1
辽宁省,国网辽宁省电力有限公司大连供电公司,2024,1
辽宁省,大连中天项目管理有限公司,2025,1
辽宁省,微控飞轮(沈阳)技术开发有限公司,2025,1
辽宁省,抚顺隆烨化工有限公司,2024,1
辽宁省,沈阳防锈包装材料有限责任公司,2024,1
辽宁省,辽宁东宇石油制管有限公司,2025,1
辽宁省,辽宁高比科技有限公司,2024,1
重庆市,中国电子科技集团公司第四十四研究所,2021,3
重庆市,中移物联网有限公司,2025,1
重庆市,深蓝汽车科技有限公司,2025,1
重庆市,重庆市了赢科技有限公司,2025,1
重庆市,重庆翰海睿智大数据科技股份有限公司,2025,1
重庆市,重庆连芯智能科技研究院有限公司,2025,1
重庆市,重庆长安新能源汽车科技有限公司,2021,1
陕西省,中国电子科技集团公司第三十九研究所,2021,2
陕西省,中国航空工业集团公司西安飞行自动控制研究所,2021,2
陕西省,易迅通科技有限公司,2021,4
陕西省,航天恒星空间技术应用有限公司,2025,1
陕西省,西安保通防务科技有限公司,2025,1
陕西省,西安安盟智能科技股份有限公司,2022,1
陕西省,西安热工研究院有限公司,2024,1
陕西省,西安瑞成聚芯智联科技有限公司,2025,1
陕西省,西安睿诺航空装备有限公司,2025,1
陕西省,西安维国电子科技有限公司,2025,1
陕西省,西安聚能超导线材科技有限公司,2023,3
陕西省,西安艾科特声学科技有限公司,2022,1
陕西省,西安西电电力系统有限公司,2025,1
陕西省,西部超导材料科技股份有限公司,2022,1
陕西省,陕西信泰航空技术股份有限公司,2024,1
陕西省,陕西铭拓机电技术有限公司,2021,1
青海省,国网青海省电力公司清洁能源发展研究院,2024,1
香港特别行政区,香港应用科技研究院有限公司,2023,1
黑龙江省,哈尔滨久霆科技有限公司,2021,1
黑龙江省,大庆市凯德信信息技术有限公司,2023,1
黑龙江省,黑龙江大数据产业发展有限公司,2025,1
黑龙江省,黑龙江睿雨能量子科技有限公司,2021,1
