编号,章节,事实或表述,来源机构,资料名称,发布日期,URL,来源等级,是否已打开核验,备注
1,第一节,量子信息主要包括量子通信、量子计算和量子精密测量,国家发展改革委,“十四五”规划《纲要》名词解释之11：量子信息,2021-12-24,https://www.ndrc.gov.cn/fggz/fzzlgh/gjfzgh/202112/t20211224_1309260.html,A,是,用于技术路线总体框架
2,第一节,量子计算、量子通信和量子精密测量技术进展,中国信息通信研究院,量子信息技术发展与应用研究报告（2025年）,2025-12-13,https://www.caict.ac.cn/kxyj/qwfb/bps/202512/t20251213_706662.htm,A,是,用于五类技术路线说明
3,第一节,我国量子信息科技主要方向及量子计算发展阶段,中国科学院学部,潘建伟院士谈我国量子信息科技发展,2025-01-14,https://casad.cas.cn/mtbd2022/202501/t20250114_5044912.html,A,是,用于技术路线和发展阶段
4,第一节,量子计算/通信/测量的通俗解释,中国科学院,量子力学诞生百年，我国正迎来加速突破,2025-07-14,https://www.cas.cn/cm/202507/t20250714_5076204.shtml,A,是,用于深入浅出说明
5,第六节,国科量子的发起背景和量子通信业务方向,人民网上海频道,未来产业赢领明天：国科量子公司,2024-01-11,https://sh.people.com.cn/n2/2024/0111/c134768-40710925.html,A,是,上海企业案例
6,第六节,科大国盾量子的业务方向,科大国盾量子技术股份有限公司,公司简介,,https://www.quantum-info.com/about/,A,是,外地企业案例
7,第六节,本源量子云服务和量子软件工具,本源量子,本源量子云,,https://qcloud.originqc.com.cn/,A,是,外地企业案例
